{
  "version": 1,
  "campaign_id": "campaign-1",
  "arm_cohort_id": "arm-v1",
  "status": "failed",
  "arm_bundle_ref": "published/arm-decision-bundle.json",
  "arm_bundle_hash": "sha256:aaaaaaaaaaaaaaaaaaaaaaaaaaaaaaaaaaaaaaaaaaaaaaaaaaaaaaaaaaaaaaaa",
  "decision_hashes": [
    "sha256:1111111111111111111111111111111111111111111111111111111111111111",
    "sha256:2222222222222222222222222222222222222222222222222222222222222222",
    "sha256:3333333333333333333333333333333333333333333333333333333333333333",
    "sha256:4444444444444444444444444444444444444444444444444444444444444444",
    "sha256:5555555555555555555555555555555555555555555555555555555555555555",
    "sha256:6666666666666666666666666666666666666666666666666666666666666666",
    "sha256:7777777777777777777777777777777777777777777777777777777777777777"
  ],
  "paper_ledger_hashes": [
    "sha256:1111111111111111111111111111111111111111111111111111111111111111",
    "sha256:2222222222222222222222222222222222222222222222222222222222222222",
    "sha256:3333333333333333333333333333333333333333333333333333333333333333",
    "sha256:4444444444444444444444444444444444444444444444444444444444444444",
    "sha256:5555555555555555555555555555555555555555555555555555555555555555",
    "sha256:6666666666666666666666666666666666666666666666666666666666666666",
    "sha256:7777777777777777777777777777777777777777777777777777777777777777"
  ],
  "provenance_root": "sha256:bbbbbbbbbbbbbbbbbbbbbbbbbbbbbbbbbbbbbbbbbbbbbbbbbbbbbbbbbbbbbbbb",
  "custody_root": "sha256:cccccccccccccccccccccccccccccccccccccccccccccccccccccccccccccccc",
  "metering_root": "sha256:dddddddddddddddddddddddddddddddddddddddddddddddddddddddddddddddd",
  "frozen_at": "2026-07-11T00:00:00Z",
  "freeze_hash": "sha256:eeeeeeeeeeeeeeeeeeeeeeeeeeeeeeeeeeeeeeeeeeeeeeeeeeeeeeeeeeeeeeee"
}
